{
  "metadonnes": {
    "nom_plateforme": "SII_PLATEFORME",
    "version": "1.0.0",
    "derniere_mise_a_jour": "2026-05-25",
    "description": "Ontologie IaaC Système d'Information Industriel"
  },
  "reseaux_globaux": {
    "VLAN10": {
      "nom": "VLAN10",
      "id": 10,
      "description": "Réseau Infrastructure & Administration",
      "sous_reseau": "192.168.10.0/24",
      "passerelle": "192.168.10.1"
    },
    "VLAN20": {
      "nom": "VLAN20",
      "id": 20,
      "description": "Réseau Terrain (Modbus/IO) CIM1-CIM2",
      "sous_reseau": "192.168.20.0/24",
      "passerelle": "192.168.20.1"
    },
    "VLAN30": {
      "nom": "VLAN30",
      "id": 30,
      "description": "Réseau Supervision (OPC-UA/SCADA) CIM2-CIM3",
      "sous_reseau": "192.168.30.0/24",
      "passerelle": "192.168.30.1"
    }
  },
  "ressources_physiques": {
    "pare_feu_principal": {
      "type": "pare-feu",
      "nom": "pare_feu_principal",
      "fonction": "Segmentation infrastructure-exterieur",
      "interfaces": {
        "wan": { "nom": "WAN", "ip": "192.168.1.197" },
        "vlan10": { "nom": "VLAN10", "ip": "192.168.10.1" },
        "vlan20": { "nom": "VLAN20", "ip": "192.168.20.1" },
        "vlan30": { "nom": "VLAN30", "ip": "192.168.30.1" }
      }
    },
    "commutateur_principal": {
      "type": "commutateur",
      "nom": "commutateur_principal", 
      "fonction": "Distribution",
      "marque": "D-Link",
      "modele": "DGS-1210-10MP Gigabit Ethernet Switch",
      "boot_version": "1.00.010",
      "firmware_version": "6.10.007",
      "hardware_version": "F1",
      "serial_number": "TM0C107001061",
      "MAC": "34-0A-33-0F-09-90",
      "ip": "192.168.10.90",
      "masque": "255.255.255.0",
      "passerelle": "192.168.10.1",
      "ports": {
        "1": { "lien": "tbd", "vlan_pvid":"1", "description":"", "type": "cuivre" },
        "2": { "lien": "tbd", "vlan_pvid":"10", "description":"réserve admin", "type": "cuivre" },
        "3": { "lien": "pi31_eth0", "vlan_pvid":"1", "description":"trunk pi31", "type": "cuivre" },
        "4": { "lien": "tbd", "vlan_pvid":"1", "description":"", "type": "cuivre" },
        "5": { "lien": "tbd", "vlan_pvid":"1", "description":"", "type": "cuivre" },
        "6": { "lien": "tbd", "vlan_pvid":"10", "description":"VLAN10", "type": "cuivre" },
        "7": { "lien": "tbd", "vlan_pvid":"20", "description":"VLAN20", "type": "cuivre" },
        "8": { "lien": "tbd", "vlan_pvid":"30", "description":"VLAN30", "type": "cuivre" },
        "9": { "lien": "tbd", "vlan_pvid":"1", "description":"", "type": "optique" },
        "10": { "lien": "tbd", "vlan_pvid":"1", "description":"", "type": "optique" }
      },
      "VLAN": {
        "default": {"id":"1", "nom":"default", "untagged":[1], "tagged": []},
        "VLAN10": {"id":"10", "nom":"VLAN10", "untagged":[2, 6], "tagged": [3,4,5]},
        "VLAN20": {"id":"20", "nom":"VLAN20", "untagged":[7], "tagged": [3]},
        "VLAN30": {"id":"30", "nom":"VLAN30", "untagged":[8], "tagged": [3]}
      }
    },
    "pi31": {
      "type": "raspberry_pi_3b",
      "nom": "pi31",
      "fonction": "Hôte de calcul Edge",
      "systeme_exploitation": "Ubuntu Server 26.04",
      "interfaces_physiques": {
        "eth0": {
          "mode": "trunk",
          "reseaux_autorises": ["VLAN10", "VLAN20", "VLAN30"],
          "ip_gestion": "192.168.10.10" 
        }
      },
      "arborescence_hote": {
        "racine_projets": "/home/pi31",
        "stockage_persistant": "/var/lib/docker/volumes"
      },
      "charges_logiques_nominales": [
        "sim-rincage",
        "api-rincage"
      ]
    },
    "pi32": {
      "type": "raspberry_pi_3b",
      "nom": "pi32",
      "fonction": "Hôte de calcul Edge",
      "systeme_exploitation": "Ubuntu Server 26.04",
      "interfaces_physiques": {
        "eth0": {
          "mode": "trunk",
          "reseaux_autorises": ["VLAN10", "VLAN20", "VLAN30"],
          "ip_gestion": "192.168.10.11" 
        }
      },
      "arborescence_hote": {
        "racine_projets": "/home/pi32",
        "stockage_persistant": "/var/lib/docker/volumes"
      },
      "charges_logiques_nominales": [
        "sim-rincage",
        "api-rincage"
      ]
    }
  },
  "ressources_logiques": {
    "sim-rincage": {
      "type": "conteneur_docker",
      "nom": "sim-rincage",
      "fonction": "Simulation physique du tambour de rinçage",
      "depot_source": "https://github.com/thibault-leblanc/sii/tree/main/configurations/conteneurs/sim/rincage",
      "chemin_deploiement": "simulation/rincage",
      "reseau_virtuel": {
        "type": "macvlan",
        "attachement_hote": "eth0",
        "vlan_cible": "VLAN20",
        "ip_statique": "192.168.20.10"
      }
    },
    "api-rincage": {
      "type": "conteneur_docker",
      "nom": "api-rincage",
      "fonction": "Automate logique de contrôle et serveur OPC-UA",
      "depot_source": "https://github.com/thibault-leblanc/sii/tree/main/configurations/conteneurs/api/rincage",
      "chemin_deploiement": "api/rincage",
      "reseau_virtuel": {
        "type": "macvlan_multiple",
        "attachement_hote": "eth0",
        "interfaces": {
          "interface_terrain": { "vlan_cible": "VLAN20", "ip_statique": "192.168.20.20" },
          "interface_scada": { "vlan_cible": "VLAN30", "ip_statique": "192.168.30.20" }
        }
      }
    }
  }
}